{
  "contract": "ConvergeCLICommandMatrix/v1",
  "schema_version": 1,
  "command_count": 57,
  "source_of_truth_for": [
    "agent-context",
    "CLI reference",
    "JSON coverage"
  ],
  "commands": [
    {
      "name": "init",
      "converge_pass": null,
      "wraps": "native (workspace templates)",
      "emits_tokens": [
        "CVG_INIT=OK|UNCHANGED|NOT_GIT|UNSAFE_PATH|USAGE_ERROR"
      ],
      "mutating": true,
      "example": "cvg init",
      "description": "Create the canonical tracked project control plane: .cvg/gate.yaml plus cvg/{brain,docs,swimlanes,tasks,execution,loop,receipts}. Non-clobbering, idempotent, and never writes credentials."
    },
    {
      "name": "capture",
      "converge_pass": 0,
      "wraps": "idea-to-brd/check-brd.sh",
      "emits_tokens": [
        "CHECK_BRD=PASS|FAIL|USAGE_ERROR"
      ],
      "mutating": false,
      "example": "cvg capture",
      "description": "Pass 0 gate — the BRD exit contract."
    },
    {
      "name": "intent",
      "converge_pass": 1,
      "wraps": "brd-docs-to-tech-req/check-tech-spec.sh",
      "emits_tokens": [
        "CHECK_TECH_SPEC=PASS|FAIL|USAGE_ERROR"
      ],
      "mutating": false,
      "example": "cvg intent",
      "description": "Pass 1 gate — the tech-spec exit contract."
    },
    {
      "name": "structure",
      "converge_pass": 2,
      "wraps": "tech-req-to-adrs/scaffold-adr.sh --check",
      "emits_tokens": [
        "CHECK_ADR=OK|FAIL|USAGE_ERROR"
      ],
      "mutating": false,
      "example": "cvg structure",
      "description": "Pass 2 gate — the ADR set."
    },
    {
      "name": "decompose --source <recipe>",
      "converge_pass": 3,
      "wraps": "seamwise prepare (compatibility alias)",
      "emits_tokens": [
        "COMPOSE=NEEDS_REVIEW|PREVIEW_READY|BLOCKED|ENGINE_UNAVAILABLE"
      ],
      "mutating": true,
      "example": "cvg decompose --source seamwise-recipe.yaml",
      "description": "Compatibility alias for cvg compose prepare. Converge invokes Seamwise and never decomposes locally; --dir is rejected with a migration error."
    },
    {
      "name": "review --adversary <e[,e]>",
      "converge_pass": 4,
      "wraps": "sketch-plans-adversarial-review/dispatch-review[-multi].sh",
      "emits_tokens": [
        "REVIEW=OK|ERROR|SKIP|TIMEOUT|USAGE_ERROR"
      ],
      "mutating": true,
      "example": "cvg review --adversary codex,kimi",
      "description": "Pass 4 dispatch — a different-family adversary (or several, merged) attacks the plans; writes a provenance-stamped objection log."
    },
    {
      "name": "review --check",
      "converge_pass": 4,
      "wraps": "sketch-plans-adversarial-review/check-consensus-gate.sh",
      "emits_tokens": [
        "CHECK_CONSENSUS=OK|FAIL|EMPTY|USAGE_ERROR"
      ],
      "mutating": false,
      "example": "cvg review --check",
      "description": "Pass 4 gate — validates the stamped objection log (cross-family, resolutions, fork B, provenance)."
    },
    {
      "name": "doctor",
      "converge_pass": 4,
      "wraps": "sketch-plans-adversarial-review/doctor.sh",
      "emits_tokens": [
        "DOCTOR=OK|FAIL"
      ],
      "mutating": false,
      "example": "cvg doctor",
      "description": "Engine readiness for Pass 4 dispatch (>=2 engines, >=1 cross-family)."
    },
    {
      "name": "compose prepare --source <recipe>",
      "converge_pass": "composed",
      "wraps": "seamwise prepare",
      "emits_tokens": [
        "COMPOSE=NEEDS_REVIEW|PREVIEW_READY|BLOCKED|ENGINE_UNAVAILABLE"
      ],
      "mutating": true,
      "example": "cvg compose prepare --source seamwise-recipe.yaml",
      "description": "Invoke compatible external Seamwise transformations and stop at the explicit delivery-plan review boundary. It never records review, compiles a TaskPlan, or materializes Task-Specs."
    },
    {
      "name": "compose review --reviewer <name> --reason <text>",
      "converge_pass": "composed",
      "wraps": "seamwise review --accept",
      "emits_tokens": [
        "COMPOSE=PREVIEW_READY|BLOCKED|ENGINE_UNAVAILABLE"
      ],
      "mutating": true,
      "example": "cvg compose review --reviewer owner --reason \"Topology accepted\"",
      "description": "Record human acceptance through Seamwise only. It never compiles a TaskPlan or invokes Task-Spec."
    },
    {
      "name": "compose preview",
      "converge_pass": "composed",
      "wraps": "seamwise compile + taskspec plan",
      "emits_tokens": [
        "COMPOSE=PREVIEW_READY|BLOCKED|ENGINE_UNAVAILABLE"
      ],
      "mutating": true,
      "example": "cvg compose preview",
      "description": "Compile the reviewed Seamwise projection, validate it through Task-Spec plan, and write no Task-Spec Markdown."
    },
    {
      "name": "compose materialize",
      "converge_pass": "composed",
      "wraps": "taskspec plan + taskspec batch",
      "emits_tokens": [
        "COMPOSE=MATERIALIZED|BLOCKED|ENGINE_UNAVAILABLE"
      ],
      "mutating": true,
      "example": "cvg compose materialize",
      "description": "Materialize the reviewed TaskPlan through Task-Spec, validate its receipt, and persist a digest-bound ConvergeCompositionReceipt/v1 with dispatch_authorized=false."
    },
    {
      "name": "compose status",
      "converge_pass": "composed",
      "wraps": "seamwise status + local receipt verification",
      "emits_tokens": [
        "COMPOSE=NEEDS_REVIEW|PREVIEW_READY|MATERIALIZED|BLOCKED|ENGINE_UNAVAILABLE"
      ],
      "mutating": false,
      "example": "cvg compose status",
      "description": "Read-only verification of composed state with exactly one safe next action."
    },
    {
      "name": "bind --task <spec>",
      "converge_pass": 7,
      "wraps": "task-to-runtime-contract/bind-runtime-contract.py",
      "emits_tokens": [
        "CHECK_RUNTIME_CONTRACT=PASS|FAIL"
      ],
      "mutating": true,
      "example": "cvg bind --task tasks/T-...md",
      "description": "Pass 7 · Bind — verify one signed Task-Spec, select the initial intra-task topology, hash-bind the evidence slice, and emit portable path guards plus vendor adapter manifests."
    },
    {
      "name": "bind --check --task <spec>",
      "converge_pass": 7,
      "wraps": "task-to-runtime-contract/check-runtime-contract.py",
      "emits_tokens": [
        "CHECK_RUNTIME_CONTRACT=PASS|FAIL"
      ],
      "mutating": false,
      "example": "cvg bind --check --task tasks/T-...md",
      "description": "Re-check Task-Spec freshness, sign-off, context hashes, topology substance, ownership, and enforcement artifacts."
    },
    {
      "name": "loop --issue <id>",
      "converge_pass": 8,
      "wraps": "task-loop/loop-kernel.sh",
      "emits_tokens": [
        "TASK_LOOP=SETTLED|LOCAL_SETTLED|NO_OP|BLOCKED|STALLED|EXHAUSTED|CANCELLED|ERROR"
      ],
      "mutating": true,
      "example": "cvg loop --issue T-... --agent codex",
      "description": "Pass 8 · Loop — attempt/verify/repeat over ONE assigned task, bounded on three axes (iterations, wall-clock, tokens) with a stagnation detector. Each attempt runs in a fresh engine process; state is durable on disk. Never selects its own work. Lands in exactly one named terminal state; an error or an exhausted budget is never reported as success."
    },
    {
      "name": "loop --gate-only --issue <id>",
      "converge_pass": 8,
      "wraps": "task-loop/loop-kernel.sh --gate-only",
      "emits_tokens": [
        "task settlement gate verdict"
      ],
      "mutating": false,
      "example": "cvg loop --gate-only --issue T-...",
      "description": "Read-only settlement verdict: resolve the task/profile and evaluate the gate without starting an engine or attempt."
    },
    {
      "name": "loop --estimate --issue <id>",
      "converge_pass": 8,
      "wraps": "task-loop/loop-kernel.sh --estimate",
      "emits_tokens": [
        "resolved budget ceiling"
      ],
      "mutating": false,
      "example": "cvg loop --estimate --issue T-...",
      "description": "Read-only preflight showing the bounded iteration, wall-clock, token, lane, model, and verification ceiling before authorization."
    },
    {
      "name": "gate [--path P]",
      "converge_pass": null,
      "wraps": "task-to-runtime-contract/check-gate.py",
      "emits_tokens": [
        "CHECK_GATE=OK|ABSENT|FORBIDDEN|ERROR"
      ],
      "mutating": false,
      "example": "cvg gate --path src/api.py",
      "description": "The standing repo write fence — parses the tracked .cvg/gate.yaml policy and answers whether a path may be written. Read-only; the one fence a Task-Spec cannot widen. With no --path it reports whether the policy parses and is active."
    },
    {
      "name": "tasks plan --manifest <TaskPlan>",
      "converge_pass": "5B",
      "wraps": "taskspec plan",
      "emits_tokens": [
        "TASK_PLAN=OK|INVALID|USAGE_ERROR"
      ],
      "mutating": false,
      "example": "cvg tasks plan --manifest seamwise/task-plan.json",
      "description": "Thin, read-only delegation to the independently installed Task-Spec engine. Converge passes the TaskPlan arguments unchanged and never derives or renders tasks."
    },
    {
      "name": "tasks new <slug>",
      "converge_pass": "5B",
      "wraps": "task-spec/generate-task-spec.sh",
      "emits_tokens": [
        "Spec written"
      ],
      "mutating": true,
      "example": "cvg tasks new add-health-endpoint",
      "description": "Create one Task-Spec in the resolved canonical backlog (cvg/tasks first; legacy tasks only when that existing layout is explicitly selected), append a created event, and rebuild state."
    },
    {
      "name": "tasks validate <spec>",
      "converge_pass": "5B",
      "wraps": "task-spec/validate-task-spec.sh",
      "emits_tokens": [
        "OK / FAIL (structural + six-tier sizing)"
      ],
      "mutating": true,
      "example": "cvg tasks validate T-...md",